{
  "level": "N4",
  "generated": "2026-06-26",
  "roots": [
    {
      "id": "ichi-juu",
      "root": "十",
      "label": "One / Ten",
      "children": [
        {
          "char": "生",
          "label": "life",
          "children": [
            {
              "char": "売",
              "label": "to sell",
              "children": []
            }
          ]
        },
        {
          "char": "土",
          "label": "soil",
          "children": []
        },
        {
          "char": "赤",
          "label": "red",
          "children": [
            {
              "char": "教",
              "label": "teach",
              "children": []
            }
          ]
        }
      ]
    },
    {
      "id": "dai",
      "root": "代",
      "label": "Replace, period",
      "children": [
        {
          "char": "貸",
          "label": "lend",
          "children": [
            {
              "char": "試",
              "label": "test, try, experiment",
              "children": []
            }
          ]
        },
        {
          "char": "世",
          "label": "twenty, world, generation",
          "children": []
        }
      ]
    },
    {
      "id": "hito",
      "root": "人",
      "label": "Person",
      "children": [
        {
          "char": "集",
          "label": "gather",
          "children": []
        },
        {
          "char": "会",
          "label": "to assemble",
          "children": []
        },
        {
          "char": "験",
          "label": "verification, effect, testing",
          "children": []
        },
        {
          "char": "以",
          "label": "by means of",
          "children": []
        },
        {
          "char": "金",
          "label": "gold",
          "children": [
            {
              "char": "銀",
              "label": "silver",
              "children": []
            }
          ]
        },
        {
          "char": "今",
          "label": "now",
          "children": []
        }
      ]
    },
    {
      "id": "kuchi",
      "root": "口",
      "label": "Mouth",
      "children": [
        {
          "char": "日",
          "label": "sun, day",
          "children": [
            {
              "char": "車",
              "label": "car",
              "children": []
            },
            {
              "char": "音",
              "label": "sound",
              "children": [
                {
                  "char": "意",
                  "label": "idea",
                  "children": []
                }
              ]
            },
            {
              "char": "早",
              "label": "early",
              "children": []
            },
            {
              "char": "朝",
              "label": "morning",
              "children": []
            },
            {
              "char": "昼",
              "label": "daytime",
              "children": []
            }
          ]
        },
        {
          "char": "目",
          "label": "eye",
          "children": [
            {
              "char": "見",
              "label": "see",
              "children": []
            },
            {
              "char": "夏",
              "label": "summer",
              "children": []
            },
            {
              "char": "真",
              "label": "true, reality",
              "children": []
            }
          ]
        }
      ]
    },
    {
      "id": "onna",
      "root": "女",
      "label": "Woman",
      "children": [
        {
          "char": "安",
          "label": "cheap",
          "children": []
        },
        {
          "char": "毎",
          "label": "every",
          "children": [
            {
              "char": "海",
              "label": "sea, ocean",
              "children": []
            }
          ]
        },
        {
          "char": "妹",
          "label": "younger sister",
          "children": []
        },
        {
          "char": "母",
          "label": "mother",
          "children": [
            {
              "char": "毎",
              "label": "every",
              "children": []
            }
          ]
        },
        {
          "char": "姉",
          "label": "elder sister",
          "children": []
        }
      ]
    },
    {
      "id": "chikara",
      "root": "力",
      "label": "Power",
      "children": [
        {
          "char": "地",
          "label": "ground",
          "children": []
        },
        {
          "char": "業",
          "label": "occupation, business",
          "children": []
        },
        {
          "char": "勉",
          "label": "diligence",
          "children": []
        },
        {
          "char": "動",
          "label": "move",
          "children": []
        }
      ]
    },
    {
      "id": "otsu",
      "root": "乙",
      "label": "Second",
      "children": [
        {
          "char": "風",
          "label": "wind",
          "children": []
        },
        {
          "char": "服",
          "label": "clothing",
          "children": []
        },
        {
          "char": "広",
          "label": "wide, broad, spacious",
          "children": [
            {
              "char": "台",
              "label": "pedestal",
              "children": [
                {
                  "char": "始",
                  "label": "commence, begin",
                  "children": []
                }
              ]
            }
          ]
        },
        {
          "char": "去",
          "label": "gone, past",
          "children": [
            {
              "char": "屋",
              "label": "roof, house, shop, seller",
              "children": [
                {
                  "char": "室",
                  "label": "room, chamber",
                  "children": []
                }
              ]
            }
          ]
        }
      ]
    },
    {
      "id": "mon",
      "root": "門",
      "label": "Gate",
      "children": [
        {
          "char": "問",
          "label": "question, ask, problem",
          "children": []
        },
        {
          "char": "間",
          "label": "between",
          "children": [
            {
              "char": "聞",
              "label": "hear, listen",
              "children": []
            }
          ]
        }
      ]
    },
    {
      "id": "tsuki",
      "root": "月",
      "label": "Month, moon",
      "children": [
        {
          "char": "明",
          "label": "bright, light",
          "children": []
        },
        {
          "char": "有",
          "label": "possess, have, exist",
          "children": []
        },
        {
          "char": "字",
          "label": "character",
          "children": []
        },
        {
          "char": "野",
          "label": "plains, field",
          "children": []
        },
        {
          "char": "町",
          "label": "town",
          "children": []
        },
        {
          "char": "歌",
          "label": "song, sing",
          "children": []
        },
        {
          "char": "持",
          "label": "hold, have",
          "children": []
        }
      ]
    },
    {
      "id": "ukanmuri",
      "root": "宀",
      "label": "Roof",
      "children": [
        {
          "char": "家",
          "label": "house, family, expert",
          "children": []
        },
        {
          "char": "室",
          "label": "room",
          "children": []
        },
        {
          "char": "安",
          "label": "cheap",
          "children": []
        }
      ]
    },
    {
      "id": "shikabane",
      "root": "尸",
      "label": "Corpse",
      "children": [
        {
          "char": "図",
          "label": "map, drawing, plan",
          "children": []
        },
        {
          "char": "文",
          "label": "sentence, literature, art",
          "children": []
        },
        {
          "char": "冬",
          "label": "winter",
          "children": []
        },
        {
          "char": "終",
          "label": "end, finish",
          "children": []
        }
      ]
    },
    {
      "id": "one-ext",
      "root": "一",
      "label": "One",
      "children": [
        {
          "char": "上",
          "label": "above, up",
          "children": []
        },
        {
          "char": "下",
          "label": "below",
          "children": []
        },
        {
          "char": "近",
          "label": "near",
          "children": []
        },
        {
          "char": "元",
          "label": "origin",
          "children": []
        },
        {
          "char": "正",
          "label": "correct, justice, righteous",
          "children": [
            {
              "char": "中",
              "label": "China",
              "children": []
            }
          ]
        },
        {
          "char": "工",
          "label": "construction",
          "children": []
        }
      ]
    },
    {
      "id": "gake",
      "root": "厂",
      "label": "Cliff",
      "children": [
        {
          "char": "質",
          "label": "substance",
          "children": []
        },
        {
          "char": "考",
          "label": "to think",
          "children": []
        }
      ]
    },
    {
      "id": "dai-hito",
      "root": "大",
      "label": "Large",
      "children": [
        {
          "char": "天",
          "label": "heavens, sky, imperial",
          "children": []
        },
        {
          "char": "英",
          "label": "outstanding",
          "children": []
        },
        {
          "char": "映",
          "label": "reflect",
          "children": []
        },
        {
          "char": "犬",
          "label": "dog",
          "children": []
        }
      ]
    },
    {
      "id": "hane",
      "root": "羽",
      "label": "Feather",
      "children": [
        {
          "char": "習",
          "label": "learn",